label,text
ham,"Hey babe, sorry i didn't get sooner. Gary can come and fix it cause he thinks he knows what it is but he doesn't go as far a Ptbo and he says it will cost  &lt;#&gt;  bucks. I don't know if it might be cheaper to find someone there ? We don't have any second hand machines at all right now, let me know what you want to do babe"
ham,U still havent got urself a jacket ah?
ham,Hmm thinking lor...
ham,Neshanth..tel me who r u?
ham,Are you going to write ccna exam this week??
ham,"Well done, blimey, exercise, yeah, i kinda remember wot that is, hmm. "
ham,5 nights...We nt staying at port step liao...Too ex
spam,"Hi babe its Chloe, how r u? I was smashed on saturday night, it was great! How was your weekend? U been missing me? SP visionsms.com Text stop to stop 150p/text"
ham,"Just checked out, heading out to drop off my stuff now"
ham,Yes see ya not on the dot
ham,S s..first time..dhoni rocks...
ham,I'm glad. You are following your dreams.
ham,"Aight, can you text me the address?"
spam,Get your garden ready for summer with a FREE selection of summer bulbs and seeds worth £33:50 only with The Scotsman this Saturday. To stop go2 notxt.co.uk
spam,100 dating service cal;l 09064012103 box334sk38ch
spam,CLAIRE here am havin borin time & am now alone U wanna cum over 2nite? Chat now 09099725823 hope 2 C U Luv CLAIRE xx Calls£1/minmoremobsEMSPOBox45PO139WA
ham,One day a crab was running on the sea shore..The waves came n cleared the footprints of the crab.. Crab asked: being my frnd y r u clearing my beautiful footprints? Waves replied: A fox was following ur footprints to catch you! thats y i cleared it off:) frndsship never lets u dwn :-) GUD nyt..
ham,"Call me, i am senthil from hsbc."
ham,"Yeah, we got one lined up for us"
ham,"U wake up already? Wat u doing? U picking us up later rite? I'm taking sq825, reaching ard 7 smth 8 like dat. U can check e arrival time. C ya soon..."
ham,Bull. Your plan was to go floating off to IKEA with me without a care in the world. So i have to live with your mess another day.
ham,"No! But we found a diff farm shop to buy some cheese. On way back now, can i call in?"
ham,"Sorry to trouble u again. Can buy 4d for my dad again? 1405, 1680, 1843. All 2 big 1 small, sat n sun. Thanx."
ham,Not yet. Just i'd like to keep in touch and it will be the easiest way to do that from barcelona. By the way how ru and how is the house?
ham,But you were together so you should be thinkin about him
spam,Call FREEPHONE 0800 542 0578 now!
ham,"Neither [in sterm voice] - i'm studying. All fine with me! Not sure the  thing will be resolved, tho. Anyway. Have a fab hols"
ham,"Yo, I'm at my parents' gettin cash. Good news: we picked up a downstem"
ham,"Easy mate, * guess the quick drink was bit ambitious."
ham,Today am going to college so am not able to atten the class.
ham,If I die I want u to have all my stuffs.
ham,Ha... Then we must walk to everywhere... Cannot take tram. My cousin said can walk to vic market from our hotel 
ham,Yup. Thk of u oso boring wat.
ham,He also knows about lunch menu only da. . I know
ham,Already am squatting is the new way of walking
spam,RCT' THNQ Adrian for U text. Rgds Vatian
ham,"That's the trouble with classes that go well - you're due a dodgey one … Expecting mine tomo! See you for recovery, same time, same place "
ham,Can come my room but cannot come my house cos my house still messy... Haha...
ham,Ok ill send you with in  &lt;DECIMAL&gt;  ok.
ham,K then 2marrow are you coming to class.
ham,"Buzz! Hey, my Love ! I think of you and hope your day goes well. Did you sleep in ? I miss you babe. I long for the moment we are together again*loving smile*"
ham,Mathews or tait or edwards or anderson
ham,"Watching cartoon, listening music &amp; at eve had to go temple &amp; church.. What about u?"
spam,U have a secret admirer who is looking 2 make contact with U-find out who they R*reveal who thinks UR so special-call on 09058094599
spam,"New Tones This week include: 1)McFly-All Ab.., 2) Sara Jorge-Shock.. 3) Will Smith-Switch.. To order follow instructions on next message"
ham,"Under the sea, there lays a rock. In the rock, there is an envelope. In the envelope, there is a paper. On the paper, there are 3 words... '"
ham,How much she payed. Suganya.
ham,"Hurry up, I've been weed-deficient for like three days"
spam,"Bears Pic Nick, and Tom, Pete and ... Dick. In fact, all types try gay chat with photo upload call 08718730666 (10p/min). 2 stop texts call 08712460324"
ham,"Depends on quality. If you want the type i sent boye, faded glory, then about 6. If you want ralphs maybe 2"
ham,I wan but too early lei... Me outside now wun b home so early... Neva mind then...
ham,Went fast asleep dear.take care.
spam,Had your mobile 11mths ? Update for FREE to Oranges latest colour camera mobiles & unlimited weekend calls. Call Mobile Upd8 on freefone 08000839402 or 2StopTxt
ham,Did u got that persons story
ham,"Dear,regret i cudnt pick call.drove down frm ctla now at cochin home.left mobile in car..ente style ishtamayoo?happy bakrid!"
ham,I've got it down to a tea. not sure which flavour
spam,"tddnewsletter@emc1.co.uk (More games from TheDailyDraw) Dear Helen, Dozens of Free Games - with great prizesWith.."
ham,See you there! 
ham,Actually getting ready to leave the house.
ham,I think that tantrum's finished so yeah I'll be by at some point
spam,U have a secret admirer. REVEAL who thinks U R So special. Call 09065174042. To opt out Reply REVEAL STOP. 1.50 per msg recd. Cust care 07821230901
ham,Let Ur Heart Be Ur Compass Ur Mind Ur Map Ur Soul Ur Guide And U Will Never loose in world....gnun - Sent via WAY2SMS.COM
ham,CHEERS U TEX MECAUSE U WEREBORED! YEAH OKDEN HUNNY R UIN WK SAT?SOUNDS LIKEYOUR HAVIN GR8FUN J! KEEP UPDAT COUNTINLOTS OF LOVEME XXXXX.
spam,Check Out Choose Your Babe Videos @ sms.shsex.netUN fgkslpoPW fgkslpo
ham,I'm in a movie... Collect car oredi...
ham,"New Theory: Argument wins d SITUATION, but loses the PERSON. So dont argue with ur friends just.. . . . kick them &amp; say, I'm always correct.!"
ham,CERI U REBEL! SWEET DREAMZ ME LITTLE BUDDY!! C YA 2MORO! WHO NEEDS BLOKES
ham,Awww dat is sweet! We can think of something to do he he! Have a nice time tonight ill probably txt u later cos im lonely :( xxx.
ham,How come i din c ü... Yup i cut my hair...
ham,"Tunji, how's the queen? how are you doing. This is just wishing you a great day. Abiola."
ham,Meet after lunch la...
spam,"You are guaranteed the latest Nokia Phone, a 40GB iPod MP3 player or a £500 prize! Txt word: COLLECT to No: 83355! IBHltd LdnW15H 150p/Mtmsgrcvd18"
ham,I have gone into get info bt dont know what to do
ham,on a Tuesday night r u 4 real
ham,Oh oh... Den muz change plan liao... Go back have to yan jiu again...
ham,"Response is one of d powerful weapon 2 occupy a place in others 'HEART'... So, always give response 2 who cares 4 U... Gud night..swt dreams..take care"
ham,Your account has been refilled successfully by INR  &lt;DECIMAL&gt; . Your KeralaCircle prepaid account balance is Rs  &lt;DECIMAL&gt; . Your Transaction ID is KR &lt;#&gt; .
ham,Nah im goin 2 the wrks with j wot bout u?
ham,"Yeah work is fine, started last week, all the same stuff as before, dull but easy and guys are fun!"
spam,How about getting in touch with folks waiting for company? Just txt back your NAME and AGE to opt in! Enjoy the community (150p/SMS)
ham,I think i am disturbing her da
ham,I wanted to wish you a Happy New Year and I wanted to talk to you about some legal advice to do with when Gary and I split but in person. I'll make a trip to Ptbo for that. I hope everything is good with you babe and I love ya :)
ham,The wine is flowing and i'm i have nevering..
ham,Did you try making another butt.
ham,Yes its possible but dint try. Pls dont tell to any one k
spam,"Loan for any purpose £500 - £75,000. Homeowners + Tenants welcome. Have you been previously refused? We can still help. Call Free 0800 1956669 or text back 'help'"
ham,"OH MR SHEFFIELD! You wanna play THAT game, okay. You're the boss and I'm the nanny. You give me a raise and I'll give YOU one!!"
ham,You call him now ok i said call him
ham,"I didnt get ur full msg..sometext is missing, send it again"
ham,O. Well uv causes mutations. Sunscreen is like essential thesedays
ham,"It's ok, at least armand's still around"
ham,Aww that's the first time u said u missed me without asking if I missed u first. You DO love me! :)
ham,Oh... Okie lor...We go on sat... 
ham,"Two fundamentals of cool life: Walk, like you are the KING...! OR Walk like you Dont care,whoever is the KING!... Gud nyt"
ham,I got to video tape pple type in message lor. U so free wan 2 help me? Hee... Cos i noe u wan 2 watch infernal affairs so ask u along. Asking shuhui oso.
spam,You are a winner U have been specially selected 2 receive £1000 or a 4* holiday (flights inc) speak to a live operator 2 claim 0871277810910p/min (18+) 
ham,My computer just fried the only essential part we don't keep spares of because my fucking idiot roommates looovvve leaving the thing running on full  &lt;#&gt; /7
ham,Hey. You got any mail?
ham,Nothing just getting msgs by dis name wit different no's..
ham,U calling me right? Call my hand phone...
ham,"Living is very simple.. Loving is also simple.. Laughing is too simple.. Winning is tooo simple.. But, being 'SIMPLE' is very difficult.. Gud nte.:-"
ham,Thankyou so much for the call. I appreciate your care.
ham,It certainly puts things into perspective when something like this happens
spam,Warner Village 83118 C Colin Farrell in SWAT this wkend @Warner Village & get 1 free med. Popcorn!Just show msg+ticket@kiosk.Valid 4-7/12. C t&c @kiosk. Reply SONY 4 mre film offers
ham,"Sorry, I'll call later"
ham,I'm reading the text i just sent you. Its meant to be a joke. So read it in that light
ham,Mm so you asked me not to call radio
ham,I'll be at mu in like  &lt;#&gt;  seconds
ham,I am in hospital da. . I will return home in evening
ham,How's ur paper?
ham,I told that am coming on wednesday.
ham,No wonder... Cos i dun rem seeing a silver car... But i thk i saw a black one...
ham,Don no da:)whats you plan?
ham,"Funny fact Nobody teaches volcanoes 2 erupt, tsunamis 2 arise, hurricanes 2 sway aroundn no 1 teaches hw 2 choose a wife Natural disasters just happens"
ham,Am not interested to do like that.
ham,Thanks love. But am i doing torch or bold.
ham,I will be gentle princess! We will make sweet gentle love...
ham,staff.science.nus.edu.sg/~phyhcmk/teaching/pc1323
ham,"Sweet, we may or may not go to 4U to meet carlos so gauge patty's interest in that"
ham,;-) ok. I feel like john lennon.
ham,Sure! I am driving but will reach my destination soon.
ham,R ü going 4 today's meeting?
ham,Hmm. Shall i bring a bottle of wine to keep us amused? Just joking! I'll still bring a bottle. Red or white? See you tomorrow
ham,"Sorry battery died, yeah I'm here"
ham,"I sent my scores to sophas and i had to do secondary application for a few schools. I think if you are thinking of applying, do a research on cost also. Contact joke ogunrinde, her school is one me the less expensive ones"
ham,Want to send me a virtual hug?... I need one
spam,Camera - You are awarded a SiPix Digital Camera! call 09061221066 fromm landline. Delivery within 28 days.
ham,Another month. I need chocolate weed and alcohol.
ham,Hey they r not watching movie tonight so i'll prob b home early...
ham,Nope i'm not drivin... I neva develop da photos lei...
spam,"Twinks, bears, scallies, skins and jocks are calling now. Don't miss the weekend's fun. Call 08712466669 at 10p/min. 2 stop texts call 08712460324(nat rate)"
spam,GENT! We are trying to contact you. Last weekends draw shows that you won a £1000 prize GUARANTEED. Call 09064012160. Claim Code K52. Valid 12hrs only. 150ppm 
ham,U meet other fren dun wan meet me ah... Muz b a guy rite...
ham,"CAN I PLEASE COME UP NOW IMIN TOWN.DONTMATTER IF URGOIN OUTL8R,JUST REALLYNEED 2DOCD.PLEASE DONTPLEASE DONTIGNORE MYCALLS,U NO THECD ISV.IMPORTANT TOME 4 2MORO"
ham,Been running but only managed 5 minutes and then needed oxygen! Might have to resort to the roller option!
ham,"Doing nothing, then u not having dinner w us?"
spam,Well done ENGLAND! Get the official poly ringtone or colour flag on yer mobile! text TONE or FLAG to 84199 NOW! Opt-out txt ENG STOP. Box39822 W111WX £1.50
ham,Hey happy birthday...
ham,Y de asking like this.
ham,Good Morning plz call me sir
ham,Pls pls find out from aunt nike.
ham,"It's wylie, you in tampa or sarasota?"
ham,Unless it's a situation where YOU GO GURL would be more appropriate
ham,Oh ho. Is this the first time u use these type of words
ham,You always make things bigger than they are
ham,But i'm surprised she still can guess right lor...
ham,Aww you must be nearly dead!Well Jez isComing over toDo some workAnd that whillTake forever!
ham,"Sorry, I'll call later"
ham,I'm at home. Please call
ham,Shopping? Eh ger i toking abt syd leh...Haha
ham,"Hmm, too many of them unfortunately... Pics obviously arent hot cakes. Its kinda fun tho"
ham,2mro i am not coming to gym machan. Goodnight.
ham,I like cheap! But i‘m happy to splash out on the wine if it makes you feel better..
ham,So i'm doing a list of buyers.
ham,I am on the way to ur home
ham,No rushing. I'm not working. I'm in school so if we rush we go hungry.
spam,XMAS Prize draws! We are trying to contact U. Todays draw shows that you have won a £2000 prize GUARANTEED. Call 09058094565 from land line. Valid 12hrs only
ham,I wanted to ask ü to wait 4 me to finish lect. Cos my lect finishes in an hour anyway.
ham,Did you get any gift? This year i didnt get anything. So bad
ham,PS U no ur a grown up now right?
ham,It has everything to do with the weather. Keep extra warm. Its a cold but nothing serious. Pls lots of vitamin c
ham,Convey my regards to him
spam,Knock Knock Txt whose there to 80082 to enter r weekly draw 4 a £250 gift voucher 4 a store of yr choice. T&Cs www.tkls.com age16 to stoptxtstop£1.50/week
spam,todays vodafone numbers ending with 0089(my last four digits) are selected to received a £350 award. If your number matches please call 09063442151 to claim your £350 award
ham,"She was supposed to be but couldn't make it, she's still in town though"
spam,"U can WIN £100 of Music Gift Vouchers every week starting NOW Txt the word DRAW to 87066 TsCs www.Idew.com SkillGame, 1Winaweek, age16. 150ppermessSubscription"
ham,"I've got ten bucks, jay is being noncomittal"
ham,Can help u swoop by picking u up from wherever ur other birds r meeting if u want.
spam,December only! Had your mobile 11mths+? You are entitled to update to the latest colour camera mobile for Free! Call The Mobile Update VCo FREE on 08002986906 
ham,"As in missionary hook up, doggy hook up, standing...|"
spam,"Dear Voucher Holder, To claim this weeks offer, at you PC please go to http://www.e-tlp.co.uk/expressoffer Ts&Cs apply. To stop texts, txt STOP to 80062"
ham,K..k:)how much does it cost?
ham,I love u 2 babe! R u sure everything is alrite. Is he being an idiot? Txt bak girlie
ham,Hmmm.but you should give it on one day..
spam,You are a winner you have been specially selected to receive £1000 cash or a £2000 award. Speak to a live operator to claim call 087147123779am-7pm. Cost 10p
ham,My trip was ok but quite tiring lor. Uni starts today but it's ok 4 me cos i'm not taking any modules but jus concentrating on my final yr project.
ham,Rightio. 11.48 it is then. Well arent we all up bright and early this morning.
ham,Oh k.k..where did you take test?
ham,Am only searching for good dual sim mobile pa.
ham,Wylie update: my weed dealer carlos went to freedom and had a class with lunsford
ham,Boy you best get yo ass out here quick
ham,"Oh, then your phone phoned me but it disconnected"
ham,Ok lor wat time ü finish?
ham,Thats cool. I want to please you...
ham,IM FINE BABES AINT BEEN UP 2 MUCH THO! SAW SCARY MOVIE YEST ITS QUITE FUNNY! WANT 2MRW AFTERNOON? AT TOWN OR MALL OR SUMTHIN?xx
spam,"Congrats! 2 mobile 3G Videophones R yours. call 09061744553 now! videochat wid ur mates, play java games, Dload polyH music, noline rentl. bx420. ip4. 5we. 150pm"
ham,U wake up already? Thanx 4 e tau sar piah it's quite nice.
ham,Oooh bed ridden ey? What are YOU thinking of?
ham,Yup but not studying surfing lor. I'm in e lazy mode today.
ham,Ugh its been a long day. I'm exhausted. Just want to cuddle up and take a nap
ham,If i start sending blackberry torch to nigeria will you find buyer for me?like 4a month. And tell dad not to buy bb from anyone oh.
ham,Ü got wat to buy tell us then ü no need to come in again.
ham,dont make ne plans for nxt wknd coz she wants us to come down then ok
ham,Thanks  and ! Or bomb and date as my phone wanted to say! 
spam,Please call our customer service representative on FREEPHONE 0808 145 4742 between 9am-11pm as you have WON a guaranteed £1000 cash or £5000 prize!
ham,"Nothing much, chillin at home. Any super bowl plan?"
ham,Did u fix the teeth?if not do it asap.ok take care.
ham,S:-)kallis wont play in first two odi:-)
ham,Hope you are having a great day.
ham,Tomarrow final hearing on my laptop case so i cant.
ham,Talk to g and x about that
ham,"HEY THERE BABE, HOW U DOIN? WOT U UP 2 2NITE LOVE ANNIE X."
ham,"Good afternoon, my boytoy ... How are you feeling today ? Better I hope? Are you being my good boy? Are you my obedient, slave? Do you please your Queen?"
ham,In that case I guess I'll see you at campus lodge
ham,Send this to ur friends and receive something about ur voice..... How is my speaking expression? 1.childish 2.naughty 3.Sentiment 4.rowdy 5.ful of attitude 6.romantic 7.shy 8.Attractive 9.funny  &lt;#&gt; .irritating  &lt;#&gt; .lovable. reply me..
ham,Then she dun believe wat?
ham,"Erm... Woodland avenue somewhere. Do you get the parish magazine, his telephone number will be in there."
ham,Thanks for this hope you had a good day today
ham,Happy birthday to you....dear.with lots of love.rakhesh NRI
ham,K.k:)i'm going to tirunelvali this week to see my uncle ..i already spend the amount by taking dress .so only i want money.i will give it on feb 1
ham,Dont you have message offer
spam,Please call Amanda with regard to renewing or upgrading your current T-Mobile handset free of charge. Offer ends today. Tel 0845 021 3680 subject to T's and C's
ham,Great! I hope you like your man well endowed. I am  &lt;#&gt;  inches...
spam,ree entry in 2 a weekly comp for a chance to win an ipod. Txt POD to 80182 to get entry (std txt rate) T&C's apply 08452810073 for details 18+
ham,Ok... C ya...
ham,"8 at the latest, g's still there if you can scrounge up some ammo and want to give the new ak a try"
ham,Your right! I'll make the appointment right now.
ham,Wat r u doing now?
ham,Wish u many many returns of the day.. Happy birthday vikky..
spam,network operator. The service is free. For T & C's visit 80488.biz
ham,"Honeybee Said: *I'm d Sweetest in d World* God Laughed &amp; Said: *Wait,U Havnt Met d Person Reading This Msg* MORAL: Even GOD Can Crack Jokes! GM+GN+GE+GN:)"
ham,"Mmmmm ... It was sooooo good to wake to your words this morning, my Love!! Mmmm fuck ... I love you too, my Lion ... *devouring kiss from across the sea*"
ham,Nutter. Cutter. Ctter. Cttergg. Cttargg. Ctargg. Ctagg. ie you
ham,Nothing. Can...
ham,"Wow. I never realized that you were so embarassed by your accomodations. I thought you liked it, since i was doing the best i could and you always seemed so happy about the cave. I'm sorry I didn't and don't have more to give. I'm sorry i offered. I'm sorry your room was so embarassing."
spam,Thanks for your subscription to Ringtone UK your mobile will be charged £5/month Please confirm by replying YES or NO. If you reply NO you will not be charged
ham,Ok. Me watching tv too.
ham,"It wont b until 2.15 as trying 2 sort house out, is that ok?"
ham,I will lick up every drop :) are you ready to use your mouth as well?
spam,You will recieve your tone within the next 24hrs. For Terms and conditions please see Channel U Teletext Pg 750
ham,"Ill call u 2mrw at ninish, with my address that icky American freek wont stop callin me 2 bad Jen k eh?"
ham,Id have to check but there's only like 1 bowls worth left
spam,"UpgrdCentre Orange customer, you may now claim your FREE CAMERA PHONE upgrade for your loyalty. Call now on 0207 153 9153. Offer ends 26th July. T&C's apply. Opt-out available"
ham,Hope you are feeling great. Pls fill me in. Abiola
spam,Free msg: Single? Find a partner in your area! 1000s of real people are waiting to chat now!Send CHAT to 62220Cncl send STOPCS 08717890890£1.50 per msg
ham,Dunno lei he neva say...
ham,Siva is in hostel aha:-.
ham,"Sorry, I'll call later"
ham,Shall i send that exe to your mail id.
ham,"Sir, waiting for your letter."
spam,Todays Vodafone numbers ending with 4882 are selected to a receive a £350 award. If your number matches call 09064019014 to receive your £350 award.
ham,Oic cos me n my sis got no lunch today my dad went out... So dunno whether 2 eat in sch or wat...
ham,"The house is on the water with a dock, a boat rolled up with a newscaster who dabbles in jazz flute behind the wheel"
ham,"There'll be a minor shindig at my place later tonight, you interested?"
ham,I sent them. Do you like?
ham,Annoying isn't it.
ham,Dear umma she called me now :-)
ham,Yup i've finished c ü there...
ham,No. Thank you. You've been wonderful
ham,Wot is u up 2 then bitch?
ham,Yes.mum lookin strong:)
spam,Someone has contacted our dating service and entered your phone because they fancy you! To find out who it is call from a landline 09111032124 . PoBox12n146tf150p
ham,Have a good evening! Ttyl
ham,How are you enjoying this semester? Take care brother.
ham,hi baby im cruisin with my girl friend what r u up 2? give me a call in and hour at home if thats alright or fone me on this fone now love jenny xxx
ham,She's fine. Sends her greetings
spam,"Dear Voucher Holder, To claim this weeks offer, at you PC please go to http://www.e-tlp.co.uk/reward. Ts&Cs apply."
ham,"Jay wants to work out first, how's 4 sound?"
ham,If You mean the website. Yes.
ham,Sad story of a Man - Last week was my b'day. My Wife did'nt wish me. My Parents forgot n so did my Kids . I went to work. Even my Colleagues did not wish.
ham,"K, can I pick up another 8th when you're done?"
ham,"By the way, make sure u get train to worc foregate street not shrub hill. Have fun night x"
ham,Ok lor... Or u wan me go look 4 u?
spam,Please CALL 08712402972 immediately as there is an urgent message waiting for you
ham,"My Parents, My Kidz, My Friends n My Colleagues. All screaming.. SURPRISE !! and I was waiting on the sofa.. ... ..... ' NAKED...!"
ham,Get down in gandhipuram and walk to cross cut road. Right side &lt;#&gt; street road and turn at first right.
ham,Did u see what I posted on your Facebook?
ham,My friends use to call the same.
ham,My darling sister. How are you doing. When's school resuming. Is there a minimum wait period before you reapply? Do take care
ham,Really good:)dhanush rocks once again:)
ham,"Vikky, come around  &lt;TIME&gt; .."
ham,So wat's da decision?
ham,I can take you at like noon
ham,I see the letter B on my car
ham,Good morning pookie pie! Lol hope I didn't wake u up
ham,Its worse if if uses half way then stops. Its better for him to complete it.
ham,"Ola would get back to you maybe not today but I ve told him you can be his direct link in the US in getting cars he bids for online, you arrange shipping and you get a cut. Or U????? For a partnership where U????? Invest money for shipping and he takes care of the rest!U??Wud b self reliant soon dnt worry"
ham,Crazy ar he's married. Ü like gd looking guys not me. My frens like say he's korean leona's fave but i dun thk he is. Aft some thinking mayb most prob i'll go.
ham,"Hiya, probably coming home * weekend after next"
ham,I don't think he has spatula hands!
spam,"Your free ringtone is waiting to be collected. Simply text the password MIX to 85069 to verify. Get Usher and Britney. FML, PO Box 5249, MK17 92H. 450Ppw 16"
ham,What time you coming down later? 
ham,Actually i deleted my old website..now i m blogging at magicalsongs.blogspot.com
spam,"Your free ringtone is waiting to be collected. Simply text the password MIX to 85069 to verify. Get Usher and Britney. FML, PO Box 5249, MK17 92H. 450Ppw 16"
spam,Moby Pub Quiz.Win a £100 High Street prize if u know who the new Duchess of Cornwall will be? Txt her first name to 82277.unsub STOP £1.50 008704050406 SP
ham,Ard 515 like dat. Y?
ham,No need for the drug anymore.
ham,U horrible gal... U knew dat i was going out wif him yest n u still come n ask me...
ham,Ultimately tor motive tui achieve korli.
ham,How's it feel? Mr. Your not my real Valentine just my yo Valentine even tho u hardly play!!
ham,"Evry Emotion dsn't hav Words.Evry Wish dsn't hav Prayrs.. If u Smile,D World is wit u.Othrwise even d Drop of Tear dsn't lik 2 Stay wit u.So b happy.. Good morning, keep smiling:-)"
ham,Good morning princess! Happy New Year!
ham,She's good. How are you. Where r u working now
ham,"K will do, addie &amp; I are doing some art so I'll be here when you get home"
ham,Haf u eaten? Wat time u wan me 2 come?
ham,I'm done oredi...
ham,"Cool, text me when you're ready"
spam,PRIVATE! Your 2003 Account Statement for shows 800 un-redeemed S. I. M. points. Call 08715203652 Identifier Code: 42810 Expires 29/10/0
ham,"Hi hope u get this txt~journey hasnt been gd,now about 50 mins late I think."
ham,"Yeah, probably but not sure. Ilol let u know, but personally I wuldnt bother, then again if ur goin to then I mite as well!!"
ham,K come to nordstrom when you're done
