label,text
ham,"They said if its gonna snow, it will start around 8 or 9 pm tonite! They are predicting an inch of accumulation."
ham,I am 6 ft. We will be a good combination!
ham,Just chill for another 6hrs. If you could sleep the pain is not a surgical emergency so see how it unfolds. Okay
ham,I'm stuck in da middle of da row on da right hand side of da lt... 
ham,"It doesnt make sense to take it there unless its free. If you need to know more, wikipedia.com"
ham,"Good afternoon sexy buns! How goes the job search ? I wake and you are my first thought as always, my love. I wish your fine and happy and know I adore you!"
ham,All sounds good. Fingers . Makes it difficult to type
ham,"I'll text carlos and let you know, hang on"
ham,Guess who spent all last night phasing in and out of the fourth dimension
ham,"Sorry sir, i will call you tomorrow.  senthil.hsbc"
spam,Free entry in 2 a wkly comp to win FA Cup final tkts 21st May 2005. Text FA to 87121 to receive entry question(std txt rate)T&C's apply 08452810075over18's
ham,Unni thank you dear for the recharge..Rakhesh
spam,"Hottest pics straight to your phone!! See me getting Wet and Wanting, just for you xx Text PICS to 89555 now! txt costs 150p textoperator g696ga 18 XxX"
ham,"Also north carolina and texas atm, you would just go to the gre site and pay for the test results to be sent."
spam,Do you want a NEW video phone750 anytime any network mins 150 text for only five pounds per week call 08000776320 now or reply for delivery tomorrow
ham,You know there is. I shall speak to you in  &lt;#&gt;  minutes then
ham,K.:)do it at evening da:)urgent:)
ham,Lol yes. Our friendship is hanging on a thread cause u won't buy stuff.
ham,Alex says he's not ok with you not being ok with it
ham,"No, but you told me you were going, before you got drunk!"
ham,"Sorry, I'll call later"
ham,How to Make a girl Happy? It's not at all difficult to make girls happy. U only need to be... 1. A friend 2. Companion 3. Lover 4. Chef . . .  &lt;#&gt; . Good listener  &lt;#&gt; . Organizer  &lt;#&gt; . Good boyfriend  &lt;#&gt; . Very clean  &lt;#&gt; . Sympathetic  &lt;#&gt; . Athletic  &lt;#&gt; . Warm . . .  &lt;#&gt; . Courageous  &lt;#&gt; . Determined  &lt;#&gt; . True  &lt;#&gt; . Dependable  &lt;#&gt; . Intelligent . . .  &lt;#&gt; . Psychologist  &lt;#&gt; . Pest exterminator  &lt;#&gt; . Psychiatrist  &lt;#&gt; . Healer . .  &lt;#&gt; . Stylist  &lt;#&gt; . Driver . . Aaniye pudunga venaam..
ham,"Night has ended for another day, morning has come in a special way. May you smile like the sunny rays and leaves your worries at the blue blue bay. Gud mrng"
ham,tap & spile at seven. * Is that pub on gas st off broad st by canal. Ok?
ham,How is your schedule next week? I am out of town this weekend.
ham,Your gonna be the death if me. I'm gonna leave a note that says its all robs fault. Avenge me.
ham,"So you think i should actually talk to him? Not call his boss in the morning? I went to this place last year and he told me where i could go and get my car fixed cheaper. He kept telling me today how much he hoped i would come back in, how he always regretted not getting my number, etc."
spam,Txt: CALL to No: 86888 & claim your reward of 3 hours talk time to use from your phone now! Subscribe6GBP/mnth inc 3hrs 16 stop?txtStop www.gamb.tv
ham,Hey! do u fancy meetin me at 4 at cha  hav a lil beverage on me. if not txt or ring me and we can meet up l8r. quite tired got in at 3 v.pist ;) love Pete x x x
ham,No da. I am happy that we sit together na
ham,Hope youre not having too much fun without me!! see u tomorrow love jess x
ham,"I‘ve got some salt, you can rub it in my open wounds if you like!"
ham,Then we gotta do it after that
ham,"Sorry light turned green, I meant another friend wanted  &lt;#&gt;  worth but he may not be around"
ham,"Me not waking up until 4 in the afternoon, sup"
spam,"Want to funk up ur fone with a weekly new tone reply TONES2U 2 this text. www.ringtones.co.uk, the original n best. Tones 3GBP network operator rates apply"
spam,PRIVATE! Your 2004 Account Statement for 078498****7 shows 786 unredeemed Bonus Points. To claim call 08719180219 Identifier Code: 45239 Expires 06.05.05
ham,Oh really?? Did you make it on air? What's your talent?
spam,EASTENDERS TV Quiz. What FLOWER does DOT compare herself to? D= VIOLET E= TULIP F= LILY txt D E or F to 84025 NOW 4 chance 2 WIN £100 Cash WKENT/150P16+
ham,"Please protect yourself from e-threats. SIB never asks for sensitive information like Passwords,ATM/SMS PIN thru email. Never share your password with anybody."
ham,"Open rebtel with firefox. When it loads just put plus sign in the user name place, and it will show you two numbers. The lower number is my number. Once you pick that number the pin will display okay!"
ham,"Hey sorry I didntgive ya a a bellearlier hunny,just been in bedbut mite go 2 thepub l8tr if uwana mt up?loads a luv Jenxxx."
ham,Just forced myself to eat a slice. I'm really not hungry tho. This sucks. Mark is getting worried. He knows I'm sick when I turn down pizza. Lol
ham,U too...
ham,Hi. Wk been ok - on hols now! Yes on for a bit of a run. Forgot that i have hairdressers appointment at four so need to get home n shower beforehand. Does that cause prob for u?
ham,I know a few people I can hit up and fuck to the yes
ham,U wan 2 haf lunch i'm in da canteen now.
spam,URGENT! We are trying to contact U. Todays draw shows that you have won a £2000 prize GUARANTEED. Call 09058094507 from land line. Claim 3030. Valid 12hrs only
ham,"Dear relieved of westonzoyland, all going to plan this end too!"
ham,"Aight, we'll head out in a few"
ham,Let me know how to contact you. I've you settled in a room. Lets know you are ok.
ham,Yup
ham,"Honeybee Said: *I'm d Sweetest in d World* God Laughed &amp; Said: *Wait,U Havnt Met d Person Reading This Msg* MORAL: Even GOD Can Crack Jokes! GM+GN+GE+GN:)"
ham,Left dessert. U wan me 2 go suntec look 4 u?
ham,Yup he msg me: is tat yijue? Then i tot it's my group mate cos we meeting today mah... I'm askin if ü leaving earlier or wat mah cos mayb ü haf to walk v far...
ham,Bbq this sat at mine from 6ish. Ur welcome 2 come
ham,What year. And how many miles.
ham,Hello hun how ru? Its here by the way. Im good. Been on 2 dates with that guy i met in walkabout so far. We have to meet up soon. Hows everyone else?
ham,I though we shd go out n have some fun so bar in town or something – sound ok?
ham,I am not sure about night menu. . . I know only about noon menu
spam,Free 1st week entry 2 TEXTPOD 4 a chance 2 win 40GB iPod or £250 cash every wk. Txt VPOD to 81303 Ts&Cs www.textpod.net custcare 08712405020.
ham,"Yetunde, i'm sorry but moji and i seem too busy to be able to go shopping. Can you just please find some other way to get what you wanted us to get. Please forgive me. You can reply free via yahoo messenger."
ham,"Hiya, sorry didn't hav signal. I haven't seen or heard from and neither has, which is unusual in itself! I'll put on the case and get him to sort it out! Hugs and snogs."
ham,Yes. Rent is very expensive so its the way we save.
ham,Cool breeze... Bright sun... Fresh flower... Twittering birds... All these waiting to wish u: GOODMORNING &amp; HAVE A NICE DAY :)
spam,Camera - You are awarded a SiPix Digital Camera! call 09061221066 fromm landline. Delivery within 28 days.
ham,Yeah if we do have to get a random dude we need to change our info sheets to PARTY  &lt;#&gt; /7 NEVER STUDY just to be safe
ham,Hey i will be late ah... Meet you at 945+
ham,The monthly amount is not that terrible and you will not pay anything till 6months after finishing school.
ham,No da if you run that it activate the full version da.
ham,Dear where you. Call me
ham,Dnt worry...use ice pieces in a cloth pack.also take 2 tablets.
ham,Ic. There are a lotta childporn cars then.
ham,"Aight yo, dats straight dogg"
ham,If we win its really no 1 side for long time.
ham,Ya even those cookies have jelly on them
spam,"U can WIN £100 of Music Gift Vouchers every week starting NOW Txt the word DRAW to 87066 TsCs www.ldew.com SkillGame,1Winaweek, age16.150ppermessSubscription"
ham,I dont know what to do to come out of this so only am ask questions like this dont mistake me.
ham,"Huh... Hyde park not in mel ah, opps, got confused... Anyway, if tt's e best choice den we juz have to take it..."
ham,on hen night. Going with a swing
ham,Hi good mornin.. Thanku wish u d same..
ham,"Fighting with the world is easy, u either win or lose bt fightng with some1 who is close to u is dificult if u lose - u lose if u win - u still lose."
spam,74355 XMAS iscoming & ur awarded either £500 CD gift vouchers & free entry 2 r £100 weekly draw txt MUSIC to 87066 TnC
ham,"I know where the  &lt;#&gt;  is, I'll be there around 5"
ham,Friendship poem: Dear O Dear U R Not Near But I Can Hear Dont Get Fear Live With Cheer No More Tear U R Always my Dear. Gud ni8
spam,FreeMsg: Txt: CALL to No: 86888 & claim your reward of 3 hours talk time to use from your phone now! Subscribe6GBP/mnth inc 3hrs 16 stop?txtStop
spam,"Today's Offer! Claim ur £150 worth of discount vouchers! Text YES to 85023 now! SavaMob, member offers mobile! T Cs 08717898035. £3.00 Sub. 16 . Unsub reply X"
ham,Got smaller capacity one? Quite ex...
ham,Your opinion about me? 1. Over 2. Jada 3. Kusruthi 4. Lovable 5. Silent 6. Spl character 7. Not matured 8. Stylish 9. Simple Pls reply..
ham,BABE !!! I miiiiiiissssssssss you ! I need you !!! I crave you !!! :-( ... Geeee ... I'm so sad without you babe ... I love you ...
ham,Lol they were mad at first but then they woke up and gave in.
ham,Dude ive been seeing a lotta corvettes lately
ham,So u gonna get deus ex?
ham,Y so late but i need to go n get da laptop...
ham,… and don‘t worry we‘ll have finished by march … ish!
ham,Ay wana meet on sat?ü wkg on sat?
spam,URGENT! We are trying to contact you. Last weekends draw shows that you have won a £900 prize GUARANTEED. Call 09061701939. Claim code S89. Valid 12hrs only
ham,"Call me when you/carlos is/are here, my phone's vibrate is acting up and I might not hear texts"
ham,Pls go there today  &lt;#&gt; . I dont want any excuses
ham,He remains a bro amongst bros
ham,"God picked up a flower and dippeditinaDEW, lovingly touched itwhichturnedinto u, and the he gifted tomeandsaid,THIS FRIEND IS 4U"
ham,I am on the way to tirupur.
ham,Do you know what Mallika Sherawat did yesterday? Find out now @  &lt;URL&gt;
ham,Only 2% students solved this CAT question in 'xam... 5+3+2= &lt;#&gt;  9+2+4= &lt;#&gt;  8+6+3= &lt;#&gt;  then 7+2+5=????? Tell me the answer if u r brilliant...1thing.i got d answr.
ham,Waiting in e car 4 my mum lor. U leh? Reach home already?
ham,What about this one then.
ham,Shopping lor. Them raining mah hard 2 leave orchard.
ham,Hurry home u big butt. Hang up on your last caller if u have to. Food is done and I'm starving. Don't ask what I cooked.
ham,Hey mr whats the name of that bill brison book the one about language and words 
ham,Don know..wait i will check it.
ham,My supervisor find 4 me one lor i thk his students. I havent ask her yet. Tell u aft i ask her.
spam,"URGENT! Your mobile number *************** WON a £2000 Bonus Caller prize on 10/06/03! This is the 2nd attempt to reach you! Call 09066368753 ASAP! Box 97N7QP, 150ppm"
ham,Hey cutie. How goes it? Here in WALES its kinda ok. There is like hills and shit but i still avent killed myself. 
spam,XMAS iscoming & ur awarded either £500 CD gift vouchers & free entry 2 r £100 weekly draw txt MUSIC to 87066 TnC www.Ldew.com1win150ppmx3age16subscription 
ham,Not directly behind... Abt 4 rows behind ü...
ham,"Yo, you gonna still be in stock tomorrow/today? I'm trying to get a dubsack"
ham,Ok lar... Joking wif u oni...
ham,Yup i thk cine is better cos no need 2 go down 2 plaza mah.
ham,"Short But Cute: Be a good person, but dont try to prove it.. .Gud noon...."
ham,Noice. Text me when you're here
ham,What should i eat fo lunch senor
ham,"Jus chillaxin, what up"
ham,"Babe, I'm back ... Come back to me ..."
ham,Ü thk of wat to eat tonight.
spam,"Sppok up ur mob with a Halloween collection of nokia logo&pic message plus a FREE eerie tone, txt CARD SPOOK to 8007"
ham,Morning only i can ok.
ham,"Ok. Can be later showing around 8-8:30 if you want + cld have drink before. Wld prefer not to spend money on nosh if you don't mind, as doing that nxt wk."
ham,Jus finish my lunch on my way home lor... I tot u dun wan 2 stay in sch today...
ham,"Fighting with the world is easy, u either win or lose bt fightng with some1 who is close to u is dificult if u lose - u lose if u win - u still lose."
ham,This pain couldn't have come at a worse time.
ham,"Princess, i like to make love  &lt;#&gt;  times per night. Hope thats not a problem!"
ham,"Okay. No no, just shining on. That was meant to be signing, but that sounds better."
ham,Dont talk to him ever ok its my word.
ham,Normally i use to drink more water daily:)
ham,"Yep, by the pretty sculpture"
ham,Nobody names their penis a girls name this story doesn't add up at all
ham,"And how you will do that, princess? :)"
ham,No calls..messages..missed calls
ham,"She is our sister.. She belongs 2 our family.. She is d hope of tomorrow.. Pray 4 her,who was fated 4 d Shoranur train incident. Lets hold our hands together &amp; fuelled by love &amp; concern prior 2 her grief &amp; pain. Pls join in dis chain &amp; pass it. STOP VIOLENCE AGAINST WOMEN."
ham,Miserable. They don't tell u that the side effects of birth control are massive gut wrenching cramps for the first 2 months. I didn't sleep at all last night.
ham,What's happening with you. Have you gotten a job and have you begun registration for permanent residency
ham,Prepare to be pleasured :)
ham,Any way where are you and what doing.
ham,Was the actual exam harder than NBME
ham,Amazing : If you rearrange these letters it gives the same meaning... Dormitory = Dirty room Astronomer = Moon starer The eyes = They see Election results = Lies lets recount Mother-in-law = Woman Hitler Eleven plus two =Twelve plus one Its Amazing... !:-)
ham,S:)8 min to go for lunch:)
ham,Hello! How r u? Im bored. Inever thought id get bored with the tv but I am. Tell me something exciting has happened there? Anything! =/
ham,I'm thinking that chennai forgot to come for auction..
ham,Then anything special?
ham,Well I might not come then...
ham,"Haha... Sounds crazy, dunno can tahan anot..."
ham,U come n search tat vid..not finishd..
ham,"Aight, text me tonight and we'll see what's up"
ham,Whats the staff name who is taking class for us?
ham,Rats. Hey did u ever vote for the next themes?
ham,Lol I was gonna last month. I cashed some in but I left &lt;#&gt; just in case. I was collecting more during the week cause they announced it on the blog.
spam,YES! The only place in town to meet exciting adult singles is now in the UK. Txt CHAT to 86688 now! 150p/Msg.
ham,So its to be poking man everyday that they teach you in canada abi! How are you. Just saying hi.
ham,The world's most happiest frnds never have the same characters... Dey just have the best understanding of their differences...
ham,Moji i love you more than words. Have a rich day
ham,"Please protect yourself from e-threats. SIB never asks for sensitive information like Passwords,ATM/SMS PIN thru email. Never share your password with anybody."
ham,"Aight text me when you're back at mu and I'll swing by, need somebody to get the door for me"
spam,"Hi babe its Jordan, how r u? Im home from abroad and lonely, text me back if u wanna chat xxSP visionsms.com Text stop to stopCost 150p 08712400603"
ham,"fyi I'm at usf now, swing by the room whenever"
ham,thanks for the temales it was wonderful. Thank. Have a great week.
ham,I am not having her number sir
ham,Pls come quick cant bare this.
ham,I wud never mind if u dont miss me or if u dont need me.. But u wil really hurt me wen u need me &amp; u dont tell me......... Take care:-)
ham,Hi. I'm sorry i missed your call. Can you pls call back.
spam,SplashMobile: Choose from 1000s of gr8 tones each wk! This is a subscrition service with weekly tones costing 300p. U have one credit - kick back and ENJOY
ham,"(And my man carlos is definitely coming by mu tonight, no excuses)"
ham,O ic lol. Should play 9 doors sometime yo
ham,I'm doing da intro covers energy trends n pros n cons... Brief description of nuclear fusion n oso brief history of iter n jet got abt 7 n half pages..
ham,I love to give massages. I use lots of baby oil... What is your fave position?
ham,Dunno lei... I thk mum lazy to go out... I neva ask her yet...
spam,Your weekly Cool-Mob tones are ready to download !This weeks new Tones include: 1) Crazy Frog-AXEL F>>> 2) Akon-Lonely>>> 3) Black Eyed-Dont P >>>More info in n
ham,Doing project w frens lor. 
ham,Just checking in on you. Really do miss seeing Jeremiah. Do have a great month
ham, what number do u live at? Is it 11?
ham,HI DARLIN IM MISSIN U HOPE YOU ARE HAVING A GOOD TIME. WHEN ARE U BACK AND WHAT TIME IF U CAN GIVE ME A CALL AT HOME. JESS XX
ham,"I can make it up there, squeezed  &lt;#&gt;  bucks out of my dad"
ham,Please tell me not all of my car keys are in your purse
ham,I was at bugis juz now wat... But now i'm walking home oredi... Ü so late then reply... I oso saw a top dat i like but din buy... Where r ü now? 
ham,"Oh, the grand is having a bit of a party but it doesn't mention any cover charge so it's probably first come first served"
ham,Ya very nice. . .be ready on thursday
ham,Lol. Well quality aint bad at all so i aint complaining
ham,I will be gentle baby! Soon you will be taking all  &lt;#&gt;  inches deep inside your tight pussy...
ham,Then ü ask dad to pick ü up lar... Ü wan 2 stay until 6 meh...
ham,You intrepid duo you! Have a great time and see you both soon. 
ham,Still chance there. If you search hard you will get it..let have a try :)
ham,Blank is Blank. But wat is blank? Lol
ham,I think chennai well settled?
ham,Watch lor. I saw a few swatch one i thk quite ok. Ard 116 but i need 2nd opinion leh...
ham,"Haha better late than ever, any way I could swing by?"
ham,Got meh... When?
ham,Yar lor... How u noe? U used dat route too?
ham,Weightloss! No more girl friends. Make loads of money on ebay or something. And give thanks to God.
ham,Is fujitsu s series lifebook good?
ham,Can ü send me a copy of da report?
ham,"Got ur mail Dileep.thank you so muchand look forward to lots of support...very less contacts here,remember one venugopal you mentioned.tomorrow if not late,i shall try to come up till there.goodnight dear."
ham,"Nothing, smsing u n xy lor. Sorry lor da guys neva c u in person but they sort of know u lor. So u wan 2 meet them xy ask me 2 bring u along 4 our next meeting."
ham,"Daddy, shu shu is looking 4 u... U wan me 2 tell him u're not in singapore or wat?"
ham,HI BABE IM AT HOME NOW WANNA DO SOMETHING? XX
spam,"449050000301 You have won a £2,000 price! To claim, call 09050000301."
ham,Busy here. Trying to finish for new year. I am looking forward to finally meeting you...
ham,Can you do a mag meeting this avo at some point?
spam,FROM 88066 LOST £12 HELP
ham,How. Its a little difficult but its a simple way to enter this place
ham,I'm in inside office..still filling forms.don know when they leave me.
ham,Yo! Howz u? girls never rang after india. L
ham,I just saw ron burgundy captaining a party boat so yeah
ham,I know girls always safe and selfish know i got it pa. Thank you. good night.
ham,Carlos is taking his sweet time as usual so let me know when you and patty are done/want to smoke and I'll tell him to haul ass
ham,Lol that's different. I don't go trying to find every real life photo you ever took.
ham,I ask if u meeting da ge tmr nite...
ham,He's just gonna worry for nothing. And he won't give you money its no use.
ham,I dont understand your message.
ham,Get ready for  &lt;#&gt;  inches of pleasure...
ham,My uncles in Atlanta. Wish you guys a great semester.
ham,Happy new years melody!
ham,Oops my phone died and I didn't even know. Yeah I like it better.
ham,"Hmmm ... I thought we said 2 hours slave, not 3 ... You are late ... How should I punish you ?"
ham,Hi baby ive just got back from work and i was wanting to see u allday! I hope i didnt piss u off on the phone today. If u are up give me a call xxx
ham,Mm yes dear look how i am hugging you both. :-P
ham,Moji just informed me that you saved our lives. Thanks.
ham,Yup i'm free...
ham,Ok i wont call or disturb any one. I know all are avoiding me. I am a burden for all
ham,No message..no responce..what happend?
ham,Is ur changes 2 da report big? Cos i've already made changes 2 da previous report.
ham,Your pussy is perfect!
ham,Only once then after ill obey all yours.
ham,So i could kiss and feel you next to me...
ham,"So check your errors and if you had difficulties, do correction."
ham,Oh k:)after that placement there ah?
ham,In e msg jus now. U said thanks for gift.
ham,Dunno y u ask me.
spam,As a Registered Subscriber yr draw 4 a £100 gift voucher will b entered on receipt of a correct ans. When are the next olympics. Txt ans to 80062
ham,K tell me anything about you.
ham,"Oh ! A half hour is much longer in Syria than Canada, eh ? Wow you must get SO much more work done in a day than us with all that extra time ! *grins*"
ham,Networking technical support associate.
ham,Do u konw waht is rael FRIENDSHIP Im gving yuo an exmpel: Jsut ese tihs msg.. Evrey splleing of tihs msg is wrnog.. Bt sitll yuo can raed it wihtuot ayn mitsake.. GOODNIGHT &amp; HAVE A NICE SLEEP..SWEET DREAMS..
ham,"Im in inperialmusic listening2the weirdest track ever byleafcutter john-sounds like insects being molested&someone plumbing,remixed by evil men on acid!"
ham,"The gas station is like a block away from my house, you'll drive right by it since armenia ends at swann and you have to take howard"
ham,"Sorry, I'll call later in meeting any thing related to trade please call Arul. &lt;#&gt; "
ham,Cuz ibored. And don wanna study
ham,Ah you see. You have to be in the lingo. I will let you know wot on earth it is when has finished making it!
ham,After the drug she will be able to eat.
ham,Home so we can always chat
ham,Ok but tell me half an hr b4 u come i need 2 prepare.
ham,here is my new address -apples&pairs&all that malarky
ham,Height of recycling: Read twice- People spend time for earning money and the same money is spent for spending time!;-) Good morning.. keep smiling:-)
ham,Also remember to get dobby's bowl from your car
ham,K..i deleted my contact that why?
ham,Thats cool princess! I will cover your face in hot sticky cum :)
ham,Am I the only one who doesn't stalk profiles?
spam,22 days to kick off! For Euro2004 U will be kept up to date with the latest news and results daily. To be removed send GET TXT STOP to 83222
ham,Do u konw waht is rael FRIENDSHIP Im gving yuo an exmpel: Jsut ese tihs msg.. Evrey splleing of tihs msg is wrnog.. Bt sitll yuo can raed it wihtuot ayn mitsake.. GOODNIGHT &amp; HAVE A NICE SLEEP..SWEET DREAMS..
ham,I will be outside office take all from there
ham,Nooooooo I'm gonna be bored to death all day. Cable and internet outage.
ham,Cos daddy arranging time c wat time fetch ü mah...
ham,"Yeah, that's fine! It's £6 to get in, is that ok? "
spam,A £400 XMAS REWARD IS WAITING FOR YOU! Our computer has randomly picked you from our loyal mobile customers to receive a £400 reward. Just call 09066380611 
ham,Ü called dad oredi...
ham,Tell your friends what you plan to do on Valentines day @ &lt;URL&gt;
ham,aathi..where are you dear..
ham,I plane to give on this month end.
ham,Then dun wear jeans lor...
ham,Beautiful truth : Expression of the face could Be seen by everyone... But the depression of heart Could be understood only By the Loved ones.. Gud Ni8;-)
ham,Alex knows a guy who sells mids but he's down in south tampa and I don't think I could set it up before like 8
ham,I tagged MY friends that you seemed to count as YOUR friends.
ham,Y dun cut too short leh. U dun like ah? She failed. She's quite sad.
spam,18 days to Euro2004 kickoff! U will be kept informed of all the latest news and results daily. Unsubscribe send GET EURO STOP to 83222.
ham,Captain vijaykanth is doing comedy in captain tv..he is drunken :)
ham,WE REGRET TO INFORM U THAT THE NHS HAS MADE A MISTAKE.U WERE NEVER ACTUALLY BORN.PLEASE REPORT 2 YOR LOCAL HOSPITAL 2B TERMINATED.WE R SORRY 4 THE INCONVENIENCE
ham,Yes! How is a pretty lady like you single?
ham,"There're some people by mu, I'm at the table by lambda"
ham,Text her. If she doesnt reply let me know so i can have her log in
spam,Dear Voucher holder Have your next meal on us. Use the following link on your pc 2 enjoy a 2 4 1 dining experiencehttp://www.vouch4me.com/etlp/dining.asp
ham,Excellent! Wish we were together right now!
spam,Double Mins & Double Txt & 1/2 price Linerental on Latest Orange Bluetooth mobiles. Call MobileUpd8 for the very latest offers. 08000839402 or call2optout/LF56
ham,"Didn't try, g and I decided not to head out"
ham,Ok. There may be a free gym about.
ham,"Probably, want to pick up more?"
ham,Give me a sec to think think about it
ham,I can send you a pic if you like :)
spam,"SPJanuary Male Sale! Hot Gay chat now cheaper, call 08709222922. National rate from 1.5p/min cheap to 7.8p/min peak! To stop texts call 08712460324 (10p/min)"
ham,Oh god..taken the teeth?is it paining
spam,"Mila, age23, blonde, new in UK. I look sex with UK guys. if u like fun with me. Text MTALK to 69866.18 . 30pp/txt 1st 5free. £1.50 increments. Help08718728876"
ham,"St andre, virgil's cream"
ham,I want  &lt;#&gt;  rs da:)do you have it?
